№,Ige (HU),Infinitivus,Példamondat (HU),Глагол (RU),Перевод (RU),Audio
1,van,lenni,Ő most az iskolában van.,"быть, находиться",Он сейчас в школе.,0001_van_m.mp3
2,tud,tudni,Nem tudok jól úszni.,"уметь, мочь; знать",Я не умею хорошо плавать.,0002_tud_m.mp3
3,lesz,lenni,Holnap otthon leszünk egész nap.,"будет, станет",Завтра мы будем дома весь день.,0003_lesz_m.mp3
4,kell,kelleni,Holnap korán kell kelnem.,"нужно, надо",Завтра мне нужно рано вставать.,0004_kell_m.mp3
5,mond,mondani,Mindig igazat mondok neked.,говорить / сказать,Я всегда говорю тебе правду.,0005_mond_m.mp3
6,akar,akarni,Ma este pizzát akarok enni.,хотеть,Сегодня вечером я хочу съесть пиццу.,0006_akar_m.mp3
7,jön,jönni,Holnap busszal jövök az iskolába.,приходить / приезжать,Завтра я приеду в школу на автобусе.,0007_jon_m.mp3
8,megy,menni,Holnap moziba megyek a barátommal.,"идти, ехать",Завтра я иду в кино с другом.,0008_megy_m.mp3
9,fog,fogni,Erősen fogom a kezedet.,"хватать, держать; вспом. глагол буд. времени",Я крепко держу твою руку.,0009_fog_m.mp3
10,lát,látni,Innen jól látom a tengert.,видеть,Отсюда я хорошо вижу море.,0010_lat_m.mp3
11,hisz,hinni,Nem hiszek neked.,верю,Я тебе не верю.,0011_hisz_m.mp3
12,tesz,tenni,A kulcsot mindig az asztalra teszem.,"класть, ставить; делать",Я всегда кладу ключ на стол.,0012_tesz_m.mp3
13,csinál,csinálni,Most a házi feladatomat csinálom.,делать / сделать,Сейчас я делаю свою домашнюю работу.,0013_csinal_m.mp3
14,szeret,szeretni,Nagyon szeretem a meleg nyári estéket.,любить,Я очень люблю тёплые летние вечера.,0014_szeret_m.mp3
15,nincs,lenni,Ma nincs időm a boltba menni.,"нет, не имеется",Сегодня у меня нет времени идти в магазин.,0015_nincs_m.mp3
16,néz,nézni,Este szívesen nézek filmet.,смотреть,Вечером я с удовольствием смотрю фильм.,0016_nez_m.mp3
17,kér,kérni,"Kérek egy pohár vizet, legyen szíves.",просить,"Можно мне стакан воды, пожалуйста?",0017_ker_m.mp3
18,beszél,beszélni,Jól beszélek magyarul.,"говорить, разговаривать",Я хорошо говорю по-венгерски.,0018_beszel_m.mp3
19,gondol,gondolni,Gyakran gondolok a nyaralásra.,думать,Я часто думаю об отпуске.,0019_gondol_m.mp3
20,ért,érteni,Most már jól értem a feladatot.,понимать,Теперь я уже хорошо понимаю задание.,0020_ert_m.mp3
21,vár,várni,A buszra várok a megállóban.,ждать,Я жду автобус на остановке.,0021_var_m.mp3
22,köszön,köszönni,Reggel mindig köszönök a szomszédoknak.,здороваться; благодарить,Утром я всегда здороваюсь с соседями.,0022_koszon_m.mp3
23,ad,adni,Most adok neked egy pohár vizet.,давать / дать,Сейчас я дам тебе стакан воды.,0023_ad_m.mp3
24,vesz,venni,Reggel mindig veszek friss kenyeret.,брать; покупать,Утром я всегда покупаю свежий хлеб.,0024_vesz_m.mp3
25,hagy,hagyni,A kulcsot az asztalon hagytam.,оставлять; позволять,Я оставил ключ на столе.,0025_hagy_m.mp3
26,áll,állni,A buszmegállóban állok és várok.,стоять,Я стою на автобусной остановке и жду.,0026_all_m.mp3
27,tart,tartani,A film két óráig tart.,длиться; держать,Фильм длится два часа.,0027_tart_m.mp3
28,talál,találni,Mindig találok jó könyveket a könyvtárban.,находить / найти,Я всегда нахожу хорошие книги в библиотеке.,0028_talal_m.mp3
29,marad,maradni,Ma este otthon maradok.,оставаться / остаться,Сегодня вечером я останусь дома.,0029_marad_m.mp3
30,hív,hívni,Este mindig hívlak telefonon.,звоню,Я всегда звоню тебе вечером по телефону.,0030_hiv_m.mp3
31,hall,hallani,Jól hallak a telefonon.,слышать,Я хорошо тебя слышу по телефону.,0031_hall_m.mp3
32,sajnál,sajnálni,Nagyon sajnálom ezt a hibát.,сожалеть; жалеть,Я очень сожалею об этой ошибке.,0032_sajnal_m.mp3
33,kap,kapni,Minden reggel friss kenyeret kapok a boltban.,получать / получить,Каждое утро я получаю свежий хлеб в магазине.,0033_kap_m.mp3
34,érez,érezni,Ma reggel nagyon jól érzem magam.,чувствовать,Сегодня утром я чувствую себя очень хорошо.,0034_erez_m.mp3
35,segít,segíteni,Szívesen segítek neked holnap.,помогать / помочь,Я с удовольствием помогу тебе завтра.,0035_segit_m.mp3
36,hoz,hozni,Mindig hozok ajándékot a buliba.,приносить / принести,Я всегда приношу подарок на вечеринку.,0036_hoz_m.mp3
37,ismer,ismerni,Jól ismerem ezt a várost.,знать (быть знакомым),Я хорошо знаю этот город.,0037_ismer_m.mp3
38,figyel,figyelni,Most figyelek a tanárra.,внимательно слушать; следить,Сейчас я слушаю учителя (внимательно).,0038_figyel_m.mp3
39,dolgozik,dolgozni,Egy nagy gyárban dolgozom.,работать,Я работаю на большом заводе.,0039_dolgozik_m.mp3
40,él,élni,Egy kis faluban élek.,жить,Я живу в маленькой деревне.,0040_el_m.mp3
41,találkozik,találkozni,Holnap találkozunk a kávézóban.,встречаться / встретиться,Завтра мы встретимся в кафе.,0041_talalkozik_m.mp3
42,próbál,próbálni,Ma este próbálunk korán lefeküdni.,пробовать,Сегодня вечером мы постараемся лечь спать пораньше.,0042_probal_m.mp3
43,keres,keresni,A munkámmal jól keresek.,искать; зарабатывать,Я хорошо зарабатываю своей работой.,0043_keres_m.mp3
44,tűnik,tűnni,Ma nagyon fáradtnak tűnsz.,казаться,Сегодня ты кажешься очень усталым.,0044_tunik_m.mp3
45,szól,szólni,A telefonom most szól a táskában.,"звучать, звонить; обращаться",Мой телефон сейчас звонит в сумке.,0045_szol_m.mp3
46,kezd,kezdeni,Reggel mindig kávéval kezdem a napot.,начинать / начать,Утром я всегда начинаю день с кофе.,0046_kezd_m.mp3
47,elmegy,elmenni,Holnap reggel elmegyek a boltba.,"уходить / уйти, уезжать",Завтра утром я схожу в магазин.,0047_elmegy_m.mp3
48,meghal,meghalni,Majdnem meghaltam a nevetéstől.,умирать / умереть,Я чуть не умер от смеха.,0048_meghal_m.mp3
49,jelent,jelenteni,"Ez a szó magyarul „víz""-et jelent.",означать,Это слово по-венгерски означает «вода».,0049_jelent_m.mp3
50,visz,vinni,Holnap viszek egy könyvet a barátomnak.,"нести, относить, везти",Завтра я отнесу книгу своему другу.,0050_visz_m.mp3
51,lehet,lehetni,Itt nem lehet parkolni.,"можно, возможно",Здесь нельзя парковаться.,0051_lehet_m.mp3
52,jár,járni,Minden reggel gyalog járok dolgozni.,"ходить, бывать; работать (о механизме)",Каждое утро я хожу на работу пешком.,0052_jar_m.mp3
53,megöl,megölni,Tegnap megöltem egy farkast.,убил,Вчера я убил волка.,0053_megol_m.mp3
54,ér,érni,Ez nagyon sokat ér nekem.,стоить (иметь цену); достигать,Это для меня очень дорого.,0054_er_m.mp3
55,elmond,elmondani,Holnap elmondom neked a titkomat.,рассказать,Завтра я расскажу тебе свой секрет.,0055_elmond_m.mp3
56,emlékszik,emlékezni,Jól emlékszem a tegnapi napra.,помнить,Я хорошо помню вчерашний день.,0056_emlekszik_m.mp3
57,örül,örülni,Nagyon örülök az ajándéknak.,радоваться (чему-л.),Я очень рад(а) подарку.,0057_orul_m.mp3
58,öl,ölni,A macska gyakran öl egeret.,убивать,Кошка часто убивает мышей.,0058_ol_m.mp3
59,ír,írni,Minden reggel írok egy üzenetet.,писать,Каждое утро я пишу одно сообщение.,0059_ir_m.mp3
60,enged,engedni,Nem engedi a kutyát az ágyra.,"пускать, позволять",Он не пускает собаку на кровать.,0060_enged_m.mp3
61,remél,remélni,"Remélem, holnap szép idő lesz.",надеяться,"Надеюсь, завтра будет хорошая погода.",0061_remel_m.mp3
62,használ,használni,Minden nap használom ezt a szótárt.,использовать,Я каждый день использую этот словарь.,0062_hasznal_m.mp3
63,megtalál,megtalálni,Végre megtaláltam a kulcsomat a táskában.,находить / найти,Я наконец нашёл свой ключ в сумке.,0063_megtalal_m.mp3
64,érdekel,érdekelni,Engem nagyon érdekel a magyar történelem.,интересовать,Меня очень интересует венгерская история.,0064_erdekel_m.mp3
65,aggódik,aggódni,Mindig aggódom a vizsga előtt.,"волноваться, беспокоиться",Я всегда волнуюсь перед экзаменом.,0065_aggodik_m.mp3
66,megvan,meglenni,"Megvan a kulcsom, mehetünk.","иметься, быть в наличии","Ключ у меня есть, можем идти.",0066_megvan_m.mp3
67,ül,ülni,Este a kanapén ülök és olvasok.,сидеть,Вечером я сижу на диване и читаю.,0067_ul_m.mp3
68,tetszik,tetszeni,Nagyon tetszik ez a piros kabát.,нравиться,Мне очень нравится это красное пальто.,0068_tetszik_m.mp3
69,tehet,tehetni,"Holnap azt teheted, amit akarsz.",мочь сделать,"Завтра ты можешь делать то, что захочешь.",0069_tehet_m.mp3
70,hal,halni,Te is éhen halsz egyszer.,умирать,Ты тоже однажды умрёшь от голода.,0070_hal_m.mp3
71,kerül,kerülni,Mennyibe kerül ez a kávé?,стоить,Сколько стоит этот кофе?,0071_kerul_m.mp3
72,történik,történni,Mi történik most odakint?,происходить / произойти,Что происходит сейчас снаружи?,0072_tortenik_m.mp3
73,megtesz,megtenni,Mindent megteszek a sikerért.,"сделать, совершить",Я делаю всё ради успеха.,0073_megtesz_m.mp3
74,kérdez,kérdezni,Mindig sokat kérdezek az órán.,спрашивать,Я всегда много спрашиваю на уроке.,0074_kerdez_m.mp3
75,mutat,mutatni,A térképen mutatom az utat.,показывать / показать,Я показываю дорогу на карте.,0075_mutat_m.mp3
76,játszik,játszani,A gyerekek délután a parkban játszanak.,играть,Дети днём играют в парке.,0076_jatszik_m.mp3
77,végez,végezni,Ma korán végzek a munkával.,заканчивать; выполнять,Сегодня я рано заканчиваю с работой.,0077_vegez_m.mp3
78,hallgat,hallgatni,Esténként szívesen hallgatok zenét.,слушать,По вечерам я с удовольствием слушаю музыку.,0078_hallgat_m.mp3
79,küld,küldeni,Minden reggel küldök egy üzenetet a barátomnak.,посылать / послать,Каждое утро я посылаю сообщение моему другу.,0079_kuld_m.mp3
80,számít,számítani,"Mindig számíthatsz rám, ha baj van.",рассчитывать (на кого-то); иметь значение,"Ты всегда можешь рассчитывать на меня, если случится беда.",0080_szamit_m.mp3
81,követ,követni,Minden reggel követem a híreket.,следить за / следовать,Каждое утро я слежу за новостями.,0081_kovet_m.mp3
82,eszik,enni,Reggel mindig kenyeret eszem.,"есть, кушать",Утром я всегда ем хлеб.,0082_eszik_m.mp3
83,vigyáz,vigyázni,"Vigyázz, nagyon csúszós az út!","беречь, присматривать; быть осторожным","Осторожно, дорога очень скользкая!",0083_vigyaz_m.mp3
84,jut,jutni,Hogyan jutok a pályaudvarra?,попадать,Как мне попасть на вокзал?,0084_jut_m.mp3
85,alszik,aludni,Este mindig sokat alszom.,спать,Вечером я всегда много сплю.,0085_alszik_m.mp3
86,megért,megérteni,Végre megértettem a feladatot.,понял,Наконец-то я понял задание.,0086_megert_m.mp3
87,ég,égni,A napon gyorsan égek.,обгораю,На солнце я быстро обгораю.,0087_eg_m.mp3
88,mehet,mehetni,Most már mehetsz haza.,"можно идти, мочь идти",Теперь ты уже можешь идти домой.,0088_mehet_m.mp3
89,szerez,szerezni,Holnap szerzek két jegyet a koncertre.,"доставать, добывать",Завтра я достану два билета на концерт.,0089_szerez_m.mp3
90,megpróbál,megpróbálni,Holnap megpróbálom megfőzni a levest.,"попробовать, попытаться",Завтра я попробую сварить суп.,0090_megprobal_m.mp3
91,indul,indulni,Holnap reggel hatkor indulunk a tengerhez.,отправляться / отправиться,Завтра утром в шесть мы отправляемся к морю.,0091_indul_m.mp3
92,iszik,inni,Reggel mindig kávét iszik.,пить,Утром он всегда пьёт кофе.,0092_iszik_m.mp3
93,fizet,fizetni,Mindig kártyával fizetek a boltban.,платить / заплатить,Я всегда плачу картой в магазине.,0093_fizet_m.mp3
94,vezet,vezetni,Minden reggel autót vezetek.,веду,Каждое утро я веду машину.,0094_vezet_m.mp3
95,sikerül,sikerülni,Végre sikerült megtalálnom a kulcsot.,удаваться / удаться,Наконец-то мне удалось найти ключ.,0095_sikerul_m.mp3
96,eljön,eljönni,Holnap este eljövök hozzátok vacsorára.,приходить / прийти,Завтра вечером я приду к вам на ужин.,0096_eljon_m.mp3
97,működik,működni,A telefonom most jól működik.,"работать, функционировать (об устройстве)",Мой телефон сейчас хорошо работает.,0097_mukodik_m.mp3
98,fogad,fogadni,Ma este vendégeket fogadunk.,принимать; держать пари,Сегодня вечером мы принимаем гостей.,0098_fogad_m.mp3
99,állít,állítani,"Mindig azt állítja, hogy igaza van.",утверждать,"Он всегда утверждает, что прав.",0099_allit_m.mp3
100,megmond,megmondani,Mindjárt megmondom neked az igazat.,"сказать, высказать",Сейчас я скажу тебе правду.,0100_megmond_m.mp3
101,nyit,nyitni,Reggel nyolckor nyitom az üzletet.,открывать / открыть,Я открываю магазин в восемь утра.,0101_nyit_m.mp3
102,esik,esni,Ma egész nap esik az eső.,идти (о дожде); падать,Сегодня весь день идёт дождь.,0102_esik_m.mp3
103,elvisz,elvinni,Holnap elviszlek az állomásra.,"увезти, отвезти, забрать",Завтра я отвезу тебя на вокзал.,0103_elvisz_m.mp3
104,imád,imádni,Imádom a csokoládét.,обожаю,Я обожаю шоколад.,0104_imad_m.mp3
105,folyik,folyni,A víz lassan folyik a csapból.,течь,Вода медленно течёт из крана.,0105_folyik_m.mp3
106,felejt,felejteni,Mindig itt felejtem a kulcsomat.,забывать (оставлять где-то),Я всегда забываю здесь свой ключ.,0106_felejt_m.mp3
107,lép,lépni,Óvatosan lépek a jeges úton.,"шагать, ступать",Я осторожно ступаю по ледяной дороге.,0107_lep_m.mp3
108,nyer,nyerni,Tegnap nyertem egy szép könyvet.,выигрывать / выиграть,Вчера я выиграл красивую книгу.,0108_nyer_m.mp3
109,megnéz,megnézni,Este megnézünk egy jó filmet.,посмотреть,Вечером мы посмотрим хороший фильм.,0109_megnez_m.mp3
110,hazudik,hazudni,"Néha hazudik, hogy ne legyen baj.","лгать, врать","Иногда он врёт, чтобы не было проблем.",0110_hazudik_m.mp3
111,dönt,dönteni,Holnap döntök az új munkáról.,решать / решить,Завтра я приму решение о новой работе.,0111_dont_m.mp3
112,meglát,meglátni,Végre megláttam a tengert!,"увидеть, заметить",Я наконец-то увидел море!,0112_meglat_m.mp3
113,rájön,rájönni,Végre rájöttem a megoldásra.,"догадаться, понять",Я наконец понял решение.,0113_rajon_m.mp3
114,bír,bírni,Nem bírom tovább ezt a meleget.,выдерживать; мочь,Я больше не могу выносить эту жару.,0114_bir_m.mp3
115,száll,szállni,Holnap repülőre szállunk.,сядем,Завтра мы сядем на самолёт.,0115_szall_m.mp3
116,utál,utálni,Nagyon utálom a hideg időt.,ненавидеть,Я очень ненавижу холодную погоду.,0116_utal_m.mp3
117,elkap,elkapni,Gyorsan elkaptam a labdát.,поймал,Я быстро поймал мяч.,0117_elkap_m.mp3
118,hangzik,hangzani,Ez a dal nagyon szépen hangzik.,звучать,Эта песня звучит очень красиво.,0118_hangzik_m.mp3
119,hat,hatni,Te jól hatsz rám.,"действовать, влиять",Ты хорошо на меня влияешь.,0119_hat_m.mp3
120,tölt,tölteni,Sok időt töltök otthon hétvégén.,проводить (время); наливать,Я провожу много времени дома в выходные.,0120_tolt_m.mp3
121,tanul,tanulni,Minden este magyarul tanulok otthon.,"учить, учиться",Каждый вечер я учу венгерский дома.,0121_tanul_m.mp3
122,megkap,megkapni,Tegnap megkaptam az új telefonomat.,получить,Вчера я получил свой новый телефон.,0122_megkap_m.mp3
123,olvas,olvasni,Esténként szívesen olvasok egy jó könyvet.,читать,По вечерам я с удовольствием читаю хорошую книгу.,0123_olvas_m.mp3
124,tartozik,tartozni,Még tíz euróval tartozom neked.,быть должным; относиться,Я ещё должен тебе десять евро.,0124_tartozik_m.mp3
125,folytat,folytatni,Holnap folytatjuk a munkát.,продолжать / продолжить,Завтра мы продолжим работу.,0125_folytat_m.mp3
126,megtud,megtudni,Holnap megtudom az eredményt.,узнать (получить информацию),Завтра я узнаю результат.,0126_megtud_m.mp3
127,húz,húzni,Most húzom a nehéz bőröndöt.,"тянуть, тащить",Сейчас я тащу тяжёлый чемодан.,0127_huz_m.mp3
128,felhív,felhívni,Holnap reggel felhívom az orvost.,позвонить (по телефону),Завтра утром я позвоню врачу.,0128_felhiv_m.mp3
129,lő,lőni,Most a nyúlra lövök.,стрелять,Я сейчас стреляю в зайца.,0129_lo_m.mp3
130,mesél,mesélni,Esténként mindig mesél a barátainak.,рассказывать,По вечерам он всегда рассказывает своим друзьям.,0130_mesel_m.mp3
131,képzel,képzelni,Gyakran szebb jövőt képzelek magamnak.,"представлять, воображать",Я часто представляю себе лучшее будущее.,0131_kepzel_m.mp3
132,lakik,lakni,Egy kis faluban lakom.,"жить, проживать",Я живу в маленькой деревне.,0132_lakik_m.mp3
133,szokik,szokni,Reggel kávét szoktam inni.,"иметь обыкновение, обычно (делать)",По утрам я обычно пью кофе.,0133_szokik_m.mp3
134,hiányzik,hiányozni,Nagyon hiányzol nekem ma.,не хватать; отсутствовать,Мне очень тебя не хватает сегодня.,0134_hianyzik_m.mp3
135,tér,térni,Most másik útra térünk.,сворачивать,Сейчас мы сворачиваем на другую дорогу.,0135_ter_m.mp3
136,elfelejt,elfelejteni,Tegnap elfelejtettem a nevedet.,забыть,Вчера я забыл твоё имя.,0136_elfelejt_m.mp3
137,fáj,fájni,Reggel óta fáj a fejem.,болеть (об ощущении),С утра у меня болит голова.,0137_faj_m.mp3
138,fordít,fordítani,Minden este angol szöveget fordítok.,переводить,Каждый вечер я перевожу английский текст.,0138_fordit_m.mp3
139,készül,készülni,Holnap egy nehéz vizsgára készülök.,"готовиться, собираться",Завтра я готовлюсь к трудному экзамену.,0139_keszul_m.mp3
140,siet,sietni,Reggel mindig sietek a munkába.,"спешить, торопиться",Утром я всегда спешу на работу.,0140_siet_m.mp3
141,készít,készíteni,Ma finom levest készítek ebédre.,"готовить, изготавливать",Сегодня я готовлю вкусный суп на обед.,0141_keszit_m.mp3
142,dob,dobni,A labdát messzire dobom.,бросать / бросить,Я бросаю мяч далеко.,0142_dob_m.mp3
143,tűz,tűzni,Nyáron a nap erősen tűz délben.,прикалывать; печь (о солнце),Летом солнце сильно печёт в полдень.,0143_tuz_m.mp3
144,elkezd,elkezdeni,Tegnap elkezdtem egy új könyvet.,начать,Вчера я начал новую книгу.,0144_elkezd_m.mp3
145,beszélget,beszélgetni,Esténként szívesen beszélgetünk a teraszon.,"беседовать, разговаривать",По вечерам мы с удовольствием беседуем на террасе.,0145_beszelget_m.mp3
146,válaszol,válaszolni,Mindig gyorsan válaszolok az emailekre.,отвечать / ответить,Я всегда быстро отвечаю на письма.,0146_valaszol_m.mp3
147,megcsinál,megcsinálni,Holnap megcsinálom a házi feladatot.,сделать,Завтра я сделаю домашнее задание.,0147_megcsinal_m.mp3
148,válik,válni,Lassan jó barátokká válunk.,становиться,Мы постепенно становимся хорошими друзьями.,0148_valik_m.mp3
149,zavar,zavarni,"Ne haragudj, zavarlak egy percre?","мешать, беспокоить","Извини, я тебя побеспокою на минутку?",0149_zavar_m.mp3
150,fordul,fordulni,Most jobbra fordulunk a sarkon.,поворачивать(ся),Сейчас мы поворачиваем направо на углу.,0150_fordul_m.mp3
151,fut,futni,Reggel mindig futok a parkban.,"бежать, бегать",Утром я всегда бегаю в парке.,0151_fut_m.mp3
152,okoz,okozni,A vihar sok kárt okozott tegnap.,"причинять, вызывать",Вчера буря причинила много вреда.,0152_okoz_m.mp3
153,választ,választani,Mindig csokoládés fagylaltot választok.,выбирать / выбрать,Я всегда выбираю шоколадное мороженое.,0153_valaszt_m.mp3
154,vág,vágni,Most vágom a kenyeret.,режу,Сейчас я режу хлеб.,0154_vag_m.mp3
155,ígér,ígérni,Ígérek neked egy könyvet.,обещать,Я обещаю тебе книгу.,0155_iger_m.mp3
156,visszajön,visszajönni,Holnap visszajövök a könyvért.,"вернуться, прийти обратно",Завтра я вернусь за книгой.,0156_visszajon_m.mp3
157,harcol,harcolni,A katonák bátran harcolnak a háborúban.,"сражаться, бороться",Солдаты храбро сражаются на войне.,0157_harcol_m.mp3
158,sír,sírni,Egész éjjel sírtam.,плакал,Я плакал всю ночь.,0158_sir_m.mp3
159,elveszt,elveszteni,Tegnap elvesztettem a kulcsomat a parkban.,потерять,Вчера я потерял свой ключ в парке.,0159_elveszt_m.mp3
160,megmutat,megmutatni,Holnap megmutatom neked a várost.,показать,Завтра я покажу тебе город.,0160_megmutat_m.mp3
161,csúszik,csúszni,Télen gyakran csúszom a jégen.,скользить,Зимой я часто скольжу по льду.,0161_csuszik_m.mp3
