№,Ige (HU),Infinitivus,Példamondat (HU),Глагол (RU),Перевод (RU),Audio
313,vall,vallani,A rendőrségen őszintén vallottam mindent.,признаваться; давать показания,В полиции я честно во всём признался.,0313_vall_m.mp3
314,késik,késni,Mindig késem az óráról.,опаздывать,Я всегда опаздываю на урок.,0314_kesik_m.mp3
315,küzd,küzdeni,Minden nap keményen küzdök a céljaimért.,"бороться, сражаться",Каждый день я упорно борюсь за свои цели.,0315_kuzd_m.mp3
316,mozog,mozogni,Reggelente sokat mozgok a parkban.,двигаться,По утрам я много двигаюсь в парке.,0316_mozog_m.mp3
317,meglátogat,meglátogatni,Holnap meglátogatom a barátomat.,навещать / навестить,Завтра я навещу своего друга.,0317_meglatogat_m.mp3
318,megér,megérni,Ez a film megéri a pénzt.,стоить (того),Этот фильм стоит своих денег.,0318_meger_m.mp3
319,árt,ártani,A sok cukor árt az egészségnek.,вредить / навредить,Много сахара вредит здоровью.,0319_art_m.mp3
320,bezár,bezárni,Este mindig bezárom az ajtót.,закрывать / запирать,Вечером я всегда закрываю дверь (на ключ).,0320_bezar_m.mp3
321,gyűlöl,gyűlölni,Gyűlölöm a hideg időt télen.,ненавидеть,Я ненавижу холодную погоду зимой.,0321_gyulol_m.mp3
322,túlél,túlélni,Szerencsére túléltem a hosszú telet.,"выжить, пережить","К счастью, я пережил долгую зиму.",0322_tulel_m.mp3
323,emlékeztet,emlékeztetni,Mindig emlékeztet engem a régi nyári napokra.,напоминать / напомнить,Это всегда напоминает мне о старых летних днях.,0323_emlekeztet_m.mp3
324,vágyik,vágyni,Néha egy kis nyugalomra vágyom.,"жаждать, страстно желать",Иногда я жажду немного покоя.,0324_vagyik_m.mp3
325,vacsorázik,vacsorázni,Ma este otthon vacsorázunk.,ужинать,Сегодня вечером мы ужинаем дома.,0325_vacsorazik_m.mp3
326,születik,születni,Egy nagyon hideg téli napon születtem.,рождаться / родиться,Я родился в очень холодный зимний день.,0326_szuletik_m.mp3
327,megegyezik,megegyezni,Végül megegyeztünk az árban.,договариваться / договориться,В конце концов мы договорились о цене.,0327_megegyezik_m.mp3
328,rúg,rúgni,Erősen rúgta a labdát.,ударил,Он сильно ударил по мячу.,0328_rug_m.mp3
329,átmegy,átmenni,Holnap átmegyek a vizsgán.,переходить / перейти; сдать (экзамен),Завтра я сдам экзамен.,0329_atmegy_m.mp3
330,múlik,múlni,Gyorsan múlik az idő nyáron.,проходить (о времени),Летом время проходит быстро.,0330_mulik_m.mp3
331,próbálkozik,próbálkozni,Még egyszer próbálkozom holnap reggel.,"пробовать, пытаться",Я попробую ещё раз завтра утром.,0331_probalkozik_m.mp3
332,megjön,megjönni,Este végre megjöttem.,пришёл,Вечером я наконец-то пришёл.,0332_megjon_m.mp3
333,figyelmeztet,figyelmeztetni,Mindig figyelmeztet engem a veszélyre.,предупреждать,Он всегда предупреждает меня об опасности.,0333_figyelmeztet_m.mp3
334,rendez,rendezni,Minden évben bulit rendezünk a kertben.,устраивать / организовывать (вечеринку); режиссировать,Каждый год мы устраиваем вечеринку в саду.,0334_rendez_m.mp3
335,mosolyog,mosolyogni,Boldogan mosolygott a tükör előtt.,улыбаться,Она счастливо улыбалась перед зеркалом.,0335_mosolyog_m.mp3
336,függ,függeni,A kabát a fogason függ.,висеть; зависеть,Пальто висит на вешалке.,0336_fugg_m.mp3
337,alakul,alakulni,Lassan minden jól alakul.,"складываться, формироваться",Постепенно всё складывается хорошо.,0337_alakul_m.mp3
338,számol,számolni,Minden este számolom a pénzt.,считать,Каждый вечер я считаю деньги.,0338_szamol_m.mp3
339,elenged,elengedni,Most elengedem a kutyát a parkban.,отпускать / отпустить,Сейчас я отпускаю собаку в парке.,0339_elenged_m.mp3
340,könyörög,könyörögni,"Sokáig könyörögtem neki, de nemet mondott.",умолять; молить,"Я долго умолял его, но он сказал нет.",0340_konyorog_m.mp3
341,randizik,randizni,Szombaton este egy fiúval randizom.,ходить на свидания; встречаться,В субботу вечером у меня свидание с парнем.,0341_randizik_m.mp3
342,álmodik,álmodni,Tegnap éjjel szépet álmodtam.,видеть сон; мечтать,Прошлой ночью мне приснился хороший сон.,0342_almodik_m.mp3
343,hasonlít,hasonlítani,Nagyon hasonlítasz az anyukádra.,"быть похожим, походить",Ты очень похож на свою маму.,0343_hasonlit_m.mp3
344,költözik,költözni,Jövő hónapban új lakásba költözöm.,переезжать / переехать,В следующем месяце я переезжаю в новую квартиру.,0344_koltozik_m.mp3
345,feltételez,feltételezni,"Feltételezem, hogy holnap esni fog.",предполагать / предположить,"Я предполагаю, что завтра будет дождь.",0345_feltetelez_m.mp3
346,helyez,helyezni,A könyvet az asztalra helyezem.,класть / помещать,Я кладу книгу на стол.,0346_helyez_m.mp3
347,fest,festeni,Ma kékre festem a szobát.,красить; рисовать; выглядеть,Сегодня я крашу комнату в синий цвет.,0347_fest_m.mp3
348,bánik,bánni,Mindig kedvesen bánik a vendégekkel.,обращаться (с кем-л.),Он всегда любезно обращается с гостями.,0348_banik_m.mp3
349,elindul,elindulni,Reggel hétkor elindulunk a vonattal.,"отправляться / отправиться, трогаться",Утром в семь мы отправляемся на поезде.,0349_elindul_m.mp3
350,bámul,bámulni,Gyakran bámulom az utcát az ablakból.,глазею,Я часто глазею на улицу из окна.,0350_bamul_m.mp3
351,származik,származni,Én Oroszországból származom.,"быть родом, происходить",Я родом из России.,0351_szarmazik_m.mp3
352,kiderít,kideríteni,Holnap kiderítem az igazságot.,выяснять / выяснить,Завтра я выясню правду.,0352_kiderit_m.mp3
353,átvesz,átvenni,Holnap átveszem a csomagot a postán.,принимать / получать,Завтра я заберу (получу) посылку на почте.,0353_atvesz_m.mp3
354,szabadul,szabadulni,Holnap szabadulok a kórházból.,освобождаться; выбираться,Завтра я выписываюсь из больницы.,0354_szabadul_m.mp3
355,dug,dugni,A kulcsot a zsebembe dugom.,"совать, засовывать",Я кладу (сую) ключ в карман.,0355_dug_m.mp3
356,indít,indítani,Reggel mindig elsőként indítom a számítógépet.,запускать / запустить; заводить,Утром я всегда первым запускаю компьютер.,0356_indit_m.mp3
357,megenged,megengedni,"Ma megengedem, hogy tovább játssz.",разрешать / позволять,Сегодня я разрешаю тебе играть дольше.,0357_megenged_m.mp3
358,főz,főzni,Ma este levest főzök vacsorára.,"варить, готовить (еду)",Сегодня вечером я варю суп на ужин.,0358_foz_m.mp3
359,parancsol,parancsolni,"Ne parancsolj nekem, kérlek!",приказывать,"Не приказывай мне, пожалуйста!",0359_parancsol_m.mp3
360,üdvözöl,üdvözölni,Üdvözlöm a vendégeket az ajtóban.,приветствовать; передавать привет,Я приветствую гостей в дверях.,0360_udvozol_m.mp3
361,biztosít,biztosítani,Minden évben biztosítom az autómat.,страховать; обеспечивать; заверять,Каждый год я страхую свою машину.,0361_biztosit_m.mp3
362,lelő,lelőni,Egy nyulat lőtt le a réten.,застрелить,Он застрелил зайца на лугу.,0362_lelo_m.mp3
363,megtart,megtartani,Megtartom ezt a régi könyvet.,"сохранить, оставить себе",Я оставлю себе эту старую книгу.,0363_megtart_m.mp3
364,old,oldani,A sót vízben oldom.,растворяю,Я растворяю соль в воде.,0364_old_m.mp3
365,megvesz,megvenni,Holnap megveszem ezt a könyvet.,купить,Завтра я куплю эту книгу.,0365_megvesz_m.mp3
366,következik,következni,Most te következel a sorban.,"быть следующим, следовать",Теперь твоя очередь (ты следующий в очереди).,0366_kovetkezik_m.mp3
367,flörtöl,flörtölni,A buliban sokat flörtöl velem.,флиртовать (с кем-л. — vkivel),На вечеринке он много флиртует со мной.,0367_flortol_m.mp3
368,illik,illeni,Ez a kalap nagyon jól illik hozzád.,"подходить, идти (кому-л.)",Эта шляпа тебе очень идёт.,0368_illik_m.mp3
369,nyúl,nyúlni,Ne nyúlj a forró tűzhelyhez!,трогать (к чему-л.),Не трогай горячую плиту!,0369_nyul_m.mp3
370,megmagyaráz,megmagyarázni,Holnap megmagyarázom neked a feladatot.,объяснить,Завтра я объясню тебе задание.,0370_megmagyaraz_m.mp3
371,hord,hordani,Télen mindig meleg sapkát hordok.,носить (одежду),Зимой я всегда ношу тёплую шапку.,0371_hord_m.mp3
372,elrabol,elrabolni,A filmben elrabolják a kislányt.,похитить,В фильме похищают девочку.,0372_elrabol_m.mp3
373,meggondol,meggondolni,Holnapig meggondolom a dolgot.,"обдумать, взвесить",Я обдумаю это дело до завтра.,0373_meggondol_m.mp3
374,ragad,ragadni,Ma egész nap itthon ragadtam.,прилипать; застрять,Сегодня я весь день застрял дома.,0374_ragad_m.mp3
375,hajt,hajtani,Gyorsan hajtok az autópályán.,ехать,Я быстро еду по автостраде.,0375_hajt_m.mp3
376,felismer,felismerni,Azonnal felismertem a régi barátomat.,"узнать, распознать",Я сразу узнал своего старого друга.,0376_felismer_m.mp3
377,kiabál,kiabálni,Miért kiabálsz rám ilyen hangosan?,кричать,Почему ты кричишь на меня так громко?,0377_kiabal_m.mp3
378,osztozik,osztozni,Mindig osztozunk a süteményen.,делиться,Мы всегда делимся пирожным.,0378_osztozik_m.mp3
379,von,vonni,Magára vonja a figyelmet.,"тянуть, притягивать",Он привлекает к себе внимание.,0379_von_m.mp3
380,belép,belépni,Reggel nyolckor belépek az irodába.,"войти, вступить",Утром в восемь я вхожу в офис.,0380_belep_m.mp3
381,feltesz,feltenni,Mindig sok kérdést teszek fel az órán.,задавать (вопрос),Я всегда задаю много вопросов на уроке.,0381_feltesz_m.mp3
382,kihagy,kihagyni,Ma reggel kihagytam a reggelit.,пропустить,Сегодня утром я пропустил завтрак.,0382_kihagy_m.mp3
383,felébred,felébredni,Reggel korán felébredtem.,проснуться,Утром я рано проснулся.,0383_felebred_m.mp3
384,sejt,sejteni,Már régóta sejtettem az igazságot.,"подозревать, предчувствовать",Я уже давно подозревал правду.,0384_sejt_m.mp3
385,ejt,ejteni,Néha véletlenül ejtek egy poharat.,роняю,Иногда я случайно роняю стакан.,0385_ejt_m.mp3
386,szerepel,szerepelni,Holnap szerepelek egy színdarabban.,"выступать, участвовать",Завтра я выступаю в спектакле.,0386_szerepel_m.mp3
387,legyőz,legyőzni,Tegnap könnyen legyőztem a barátomat sakkban.,"победить, одолеть",Вчера я легко победил друга в шахматы.,0387_legyoz_m.mp3
388,kimond,kimondani,Végre kimondtam az igazságot.,"произнести, высказать",Я наконец высказал правду.,0388_kimond_m.mp3
389,gyakorol,gyakorolni,Minden reggel gyakorlom a magyar szavakat.,"тренировать(ся), упражняться, повторять",Каждое утро я повторяю венгерские слова.,0389_gyakorol_m.mp3
390,szakít,szakítani,Tegnap szakított a barátjával.,расстаться (с кем-л.); рвать,Вчера она рассталась со своим парнем.,0390_szakit_m.mp3
391,felkészül,felkészülni,Holnap jól felkészülök a vizsgára.,подготовиться,Завтра я хорошо подготовлюсь к экзамену.,0391_felkeszul_m.mp3
392,hibáztat,hibáztatni,Mindig másokat hibáztat a hibákért.,"винить, обвинять",Он всегда винит других в ошибках.,0392_hibaztat_m.mp3
393,eldönt,eldönteni,"Holnap eldöntöm, hová utazunk.",решить,"Завтра я решу, куда мы поедем.",0393_eldont_m.mp3
394,csal,csalni,Soha nem csalok a vizsgán.,жульничать,Я никогда не жульничаю на экзамене.,0394_csal_m.mp3
395,felel,felelni,Mindig gyorsan felel a kérdésekre.,отвечать,Он/она всегда быстро отвечает на вопросы.,0395_felel_m.mp3
396,meghív,meghívni,Holnap meghívlak egy kávéra.,пригласить,Завтра я приглашу тебя на кофе.,0396_meghiv_m.mp3
397,akad,akadni,A halászléban néha akad egy szálka.,"попадаться, находиться",В рыбном супе иногда попадается косточка.,0397_akad_m.mp3
398,ragaszkodik,ragaszkodni,Mindig ragaszkodom a reggeli kávémhoz.,настаивать / держаться (за),Я всегда держусь за свой утренний кофе.,0398_ragaszkodik_m.mp3
399,kifizet,kifizetni,Tegnap kifizettem a számlát.,"оплатить, выплатить",Вчера я оплатил счёт.,0399_kifizet_m.mp3
400,tisztel,tisztelni,Nagyon tisztelem a tanáromat.,уважать,Я очень уважаю своего учителя.,0400_tisztel_m.mp3
401,fedez,fedezni,A biztosítás mindent fedez.,покрывать,Страховка покрывает всё.,0401_fedez_m.mp3
402,érdemel,érdemelni,Szerintem jobb fizetést érdemelsz.,заслуживать,"По-моему, ты заслуживаешь лучшую зарплату.",0402_erdemel_m.mp3
403,azonosít,azonosítani,Gyorsan azonosítottam a problémát.,"идентифицировать, определить",Я быстро определил проблему.,0403_azonosit_m.mp3
404,kinyír,kinyírni,Tegnap kinyírtak egy bankrablót.,"прикончить, укокошить",Вчера прикончили одного грабителя банка.,0404_kinyir_m.mp3
405,megérdemel,megérdemelni,Megérdemelsz egy kis pihenést ma.,заслуживать,Ты заслуживаешь немного отдыха сегодня.,0405_megerdemel_m.mp3
406,elkésik,elkésni,Ma reggel elkéstem a munkáról.,опоздать,Сегодня утром я опоздал на работу.,0406_elkesik_m.mp3
407,hazajön,hazajönni,Ma este későn jövök haza.,вернуться домой,Сегодня вечером я вернусь домой поздно.,0407_hazajon_m.mp3
408,tekint,tekinteni,Barátomnak tekintem őt.,считать (кем-л.),Я считаю его своим другом.,0408_tekint_m.mp3
409,elmagyaráz,elmagyarázni,Most elmagyarázom neked a feladatot.,объяснить,Сейчас я объясню тебе задание.,0409_elmagyaraz_m.mp3
410,cselekszik,cselekedni,Mindig gyorsan cselekszem vészhelyzetben.,"действовать, поступать",В чрезвычайной ситуации я всегда действую быстро.,0410_cselekszik_m.mp3
411,megszabadul,megszabadulni,Végre megszabadultam a régi telefonomtól.,"избавиться, освободиться",Наконец-то я избавился от старого телефона.,0411_megszabadul_m.mp3
412,cserél,cserélni,Holnap pénzt cserélek a bankban.,обменять,Завтра я обменяю деньги в банке.,0412_cserel_m.mp3
413,tisztáz,tisztázni,Tegnap végre tisztáztuk a félreértést.,"выяснить, прояснить",Вчера мы наконец прояснили недоразумение.,0413_tisztaz_m.mp3
414,megnyer,megnyerni,Tegnap megnyertük a meccset.,"выиграть, победить",Вчера мы выиграли матч.,0414_megnyer_m.mp3
415,felkel,felkelni,Minden reggel hatkor felkelek.,вставать (с постели),Я встаю в шесть часов утра каждый день.,0415_felkel_m.mp3
416,lemond,lemondani,Lemondok a holnapi találkozóról.,отказаться / отменить,Я отказываюсь от завтрашней встречи.,0416_lemond_m.mp3
417,közeledik,közeledni,Lassan közeledünk a városhoz.,приближаться (к чему-л.),Мы медленно приближаемся к городу.,0417_kozeledik_m.mp3
418,eljut,eljutni,Gyorsan eljutottam a vasútállomásra.,добраться (до чего-л.),Я быстро добрался до железнодорожного вокзала.,0418_eljut_m.mp3
419,vizsgál,vizsgálni,Most vizsgálom a beteget.,осматривать,Я сейчас осматриваю больного.,0419_vizsgal_m.mp3
420,ünnepel,ünnepelni,Ma este a barátaimmal ünnepelünk.,"праздновать, отмечать",Сегодня вечером мы празднуем с моими друзьями.,0420_unnepel_m.mp3
421,kényszerít,kényszeríteni,Nem kényszerítelek semmire.,"принуждать, заставлять (кого-л. к чему-л.)",Я ни к чему тебя не принуждаю.,0421_kenyszerit_m.mp3
422,vádol,vádolni,Mindig engem vádolnak lopással.,обвинять,Они всегда обвиняют меня в краже.,0422_vadol_m.mp3
423,öregszik,öregedni,Az ember lassan öregszik.,стареть,Человек медленно стареет.,0423_oregszik_m.mp3
424,megfelel,megfelelni,Ez az időpont nekem tökéletesen megfelel.,"подходить, соответствовать (кому-л. — дат.)",Это время мне прекрасно подходит.,0424_megfelel_m.mp3
425,lemegy,lemenni,Reggel mindig gyorsan lemegyek a boltba.,спускаться / сходить вниз,Утром я всегда быстро спускаюсь в магазин.,0425_lemegy_m.mp3
426,átnéz,átnézni,Reggel mindig átnézem az e-mailjeimet.,"просмотреть, проверить",Утром я всегда просматриваю свои электронные письма.,0426_atnez_m.mp3
427,úszik,úszni,Reggelente a tóban úszom.,плавать,По утрам я плаваю в озере.,0427_uszik_m.mp3
428,reagál,reagálni,Gyorsan reagáltam az üzenetre.,реагировать (на что-л.),Я быстро отреагировал на сообщение.,0428_reagal_m.mp3
429,tönkretesz,tönkretenni,Tegnap véletlenül tönkretettem a telefonomat.,"разрушить, испортить, погубить",Вчера я случайно сломал свой телефон.,0429_tonkretesz_m.mp3
430,felfog,felfogni,Most végre felfogom a helyzetet.,"понять, осознать",Теперь я наконец осознаю ситуацию.,0430_felfog_m.mp3
431,odamegy,odamenni,"Odamegyek a pénztárhoz, és fizetek.",подойти / пойти туда,Я подхожу к кассе и плачу.,0431_odamegy_m.mp3
432,aláír,aláírni,Ma reggel aláírtam a szerződést.,подписать,Сегодня утром я подписал договор.,0432_alair_m.mp3
433,megfog,megfogni,Gyorsan megfogtam a labdát.,схватить / поймать,Я быстро поймал мяч.,0433_megfog_m.mp3
434,csap,csapni,Néha az asztalra csapok dühömben.,ударить / хлопнуть,Иногда я в гневе хлопаю по столу.,0434_csap_m.mp3
435,mos,mosni,Reggel mindig kezet mosok.,мыть / стирать,Утром я всегда мою руки.,0435_mos_m.mp3
436,utal,utalni,Holnap utalom a pénzt.,переводить (деньги),Завтра я переведу деньги.,0436_utal_m.mp3
437,javít,javítani,Most javítom a régi biciklimet.,"чинить, ремонтировать",Сейчас я чиню свой старый велосипед.,0437_javit_m.mp3
438,csókol,csókolni,Reggel mindig megpuszilom és csókolom őt.,целовать,Утром я всегда его чмокаю и целую.,0438_csokol_m.mp3
439,leül,leülni,"Fáradt vagyok, leülök egy kicsit.",сесть / присесть,"Я устал, присяду ненадолго.",0439_leul_m.mp3
440,fúj,fújni,Ma erősen fúj a szél kint.,дуть,Сегодня на улице сильно дует ветер.,0440_fuj_m.mp3
441,felmegy,felmenni,Reggel gyalog megyek fel a lépcsőn.,"подниматься, идти наверх",Утром я иду наверх по лестнице пешком.,0441_felmegy_m.mp3
442,levesz,levenni,Reggel mindig leveszem a kabátomat.,снять (снимать),Утром я всегда снимаю своё пальто.,0442_levesz_m.mp3
443,kockáztat,kockáztatni,Most nem kockáztatok semmit.,рисковать,Сейчас я ничем не рискую.,0443_kockaztat_m.mp3
444,rohan,rohanni,Minden reggel a buszhoz rohanok.,"мчаться, нестись",Каждое утро я мчусь к автобусу.,0444_rohan_m.mp3
445,elolvas,elolvasni,Tegnap elolvastam egy érdekes könyvet.,прочитать,Вчера я прочитал интересную книгу.,0445_elolvas_m.mp3
446,üldöz,üldözni,Üldözzük a tolvajt az utcán.,преследовать,Мы преследуем вора на улице.,0446_uldoz_m.mp3
447,odaér,odaérni,Időben odaértünk az állomásra.,добраться,Мы вовремя добрались до вокзала.,0447_odaer_m.mp3
448,elképzel,elképzelni,Nehezen képzelem el a jövőt.,"представить себе, вообразить",Мне трудно представить себе будущее.,0448_elkepzel_m.mp3
449,meggyőz,meggyőzni,Végül meggyőztem őt az igazamról.,убедить (кого-л. в чём-л.),В конце концов я убедил его в своей правоте.,0449_meggyoz_m.mp3
450,kijut,kijutni,Végre kijutottunk a friss levegőre.,"выбраться, попасть наружу",Наконец-то мы выбрались на свежий воздух.,0450_kijut_m.mp3
451,otthagy,otthagyni,Tegnap otthagytam a táskámat a buszon.,"оставить, бросить",Вчера я оставил свою сумку в автобусе.,0451_otthagy_m.mp3
452,kidob,kidobni,Tegnap kidobtam a régi cipőmet.,выбросить,Вчера я выбросил свои старые туфли.,0452_kidob_m.mp3
453,egyezik,egyezni,A válaszod pontosan egyezik az enyémmel.,совпадать (с чем-л.),Твой ответ точно совпадает с моим.,0453_egyezik_m.mp3
454,kiszáll,kiszállni,A megállóban szállok ki a buszból.,выходить (из транспорта),Я выхожу из автобуса на остановке.,0454_kiszall_m.mp3
455,elalszik,elaludni,Tegnap este gyorsan elaludtam a kanapén.,заснуть,Вчера вечером я быстро заснул на диване.,0455_elalszik_m.mp3
456,kihasznál,kihasználni,Mindig kihasználom a jó időt.,"использовать, воспользоваться",Я всегда использую хорошую погоду.,0456_kihasznal_m.mp3
457,teljesít,teljesíteni,Mindig teljesítem a kötelességemet.,выполнять,Я всегда выполняю свой долг.,0457_teljesit_m.mp3
458,visszakap,visszakapni,Holnap visszakapom a pénzemet.,получить обратно,Завтра я получу обратно свои деньги.,0458_visszakap_m.mp3
459,megvár,megvárni,Megvárlak téged a sarkon.,дождаться (кого-л.),Я дождусь тебя на углу.,0459_megvar_m.mp3
460,töröl,törölni,Most törlöm a régi fényképeket.,"удалять, стирать",Сейчас я удаляю старые фотографии.,0460_torol_m.mp3
